{
  "$schema": "../../schemas/agency-catalog.schema.json",
  "_comment": "NAUI Course Catalog - Source Data",
  "_note": "This is SOURCE DATA for import, not a direct database dump. The sync script (lib/jobs/sync-agency-catalogs.server.ts) transforms this into agency_course_templates records by: (1) Looking up agencyId from certification_agencies where code='naui', (2) Mapping levelCode to levelId via certification_levels lookup, (3) Generating contentHash from course fields, (4) Adding sourceType='static_json', timestamps, etc. Tenant-specific fields (price, isActive, etc.) are NOT in this file - they're set when tenants import courses.",
  "agency": "naui",
  "agencyName": "National Association of Underwater Instructors",
  "version": "2026.1",
  "lastUpdated": "2026-01-25",
  "courses": [
    {
      "name": "Snorkeler",
      "code": "SNORK",
      "levelCode": "beginner",
      "description": "The NAUI Snorkeler program introduces participants to the skills and knowledge needed to safely observe underwater attractions from or near the surface of the water. Learn proper breathing techniques, equipment use, and surface swimming skills.",
      "images": [
        "https://images.unsplash.com/photo-1544551763-46a013bb70d5?w=600&h=400&fit=crop"
      ],
      "durationDays": 1,
      "classroomHours": 2,
      "poolHours": 2,
      "openWaterDives": 0,
      "prerequisites": null,
      "minAge": 8,
      "medicalRequirements": "NAUI Medical History form required",
      "requiredItems": [
        "Mask, fins, and snorkel",
        "Wetsuit or exposure protection"
      ],
      "materialsIncluded": true
    },
    {
      "name": "Skin Diver",
      "code": "SD",
      "levelCode": "beginner",
      "description": "The NAUI Skin Diver course teaches breath-hold diving techniques for exploring the underwater world without scuba equipment. Develop surface diving skills, breath-hold techniques, and underwater swimming abilities.",
      "images": [
        "https://images.unsplash.com/photo-1544551763-46a013bb70d5?w=600&h=400&fit=crop"
      ],
      "durationDays": 1,
      "classroomHours": 3,
      "poolHours": 3,
      "openWaterDives": 0,
      "prerequisites": null,
      "minAge": 10,
      "medicalRequirements": "NAUI Medical History form required",
      "requiredItems": [
        "Mask, fins, and snorkel",
        "Wetsuit or exposure protection",
        "Weight belt"
      ],
      "materialsIncluded": true
    },
    {
      "name": "Scuba Diver (Supervised Diver - ISO Level 1)",
      "code": "SCD",
      "levelCode": "beginner",
      "description": "The NAUI Scuba Diver course is an introductory scuba program meeting ISO Level 1 supervised diver requirements (24801-1). This course prepares non-divers to enjoy scuba diving in open water under controlled conditions with professional supervision.",
      "images": [
        "https://images.unsplash.com/photo-1544551763-46a013bb70d5?w=600&h=400&fit=crop"
      ],
      "durationDays": 2,
      "classroomHours": 6,
      "poolHours": 6,
      "openWaterDives": 2,
      "prerequisites": null,
      "minAge": 10,
      "medicalRequirements": "NAUI Medical History form required",
      "requiredItems": [
        "Mask, fins, and snorkel",
        "Wetsuit or exposure protection",
        "BCD (Buoyancy Control Device)",
        "Regulator with alternate air source"
      ],
      "materialsIncluded": true
    },
    {
      "name": "Open Water Scuba Diver (Autonomous - ISO Level 2)",
      "code": "OWD",
      "levelCode": "beginner",
      "description": "The NAUI Open Water Scuba Diver course is designed to train students in the knowledge and skills necessary to dive safely in open water. Upon certification, divers are qualified to dive without supervision within the limits of their training, to maximum recreational depths.",
      "images": [
        "https://nauiwebsitestorage.blob.core.windows.net/media/2024/09/open-water.webp"
      ],
      "durationDays": 4,
      "classroomHours": 12,
      "poolHours": 10,
      "openWaterDives": 4,
      "prerequisites": null,
      "minAge": 15,
      "medicalRequirements": "NAUI Medical History form required",
      "requiredItems": [
        "Mask, fins, and snorkel",
        "Wetsuit or exposure protection",
        "Weight system",
        "BCD (Buoyancy Control Device)",
        "Regulator with alternate air source",
        "Dive computer or tables"
      ],
      "materialsIncluded": true
    },
    {
      "name": "Junior Open Water Scuba Diver",
      "code": "JOWD",
      "levelCode": "beginner",
      "description": "The NAUI Junior Open Water Scuba Diver course provides the same comprehensive training as the adult program, designed specifically for divers aged 10-14. Junior divers must dive with a certified adult.",
      "images": [
        "https://images.unsplash.com/photo-1544551763-46a013bb70d5?w=600&h=400&fit=crop"
      ],
      "durationDays": 4,
      "classroomHours": 12,
      "poolHours": 10,
      "openWaterDives": 4,
      "prerequisites": null,
      "minAge": 10,
      "medicalRequirements": "NAUI Medical History form and parental consent required",
      "requiredItems": [
        "Mask, fins, and snorkel",
        "Wetsuit or exposure protection",
        "Weight system",
        "BCD (Buoyancy Control Device)",
        "Regulator with alternate air source"
      ],
      "materialsIncluded": true
    },
    {
      "name": "Experienced Scuba Diver",
      "code": "ESD",
      "levelCode": "beginner",
      "description": "The NAUI Experienced Scuba Diver program is designed for divers with military, commercial, or scientific diving training who may not hold formal recreational certification. Upon completion, divers receive NAUI Open Water Scuba Diver certification.",
      "images": [
        "https://images.unsplash.com/photo-1544551763-46a013bb70d5?w=600&h=400&fit=crop"
      ],
      "durationDays": 2,
      "classroomHours": 4,
      "poolHours": 4,
      "openWaterDives": 2,
      "prerequisites": "Prior diving experience (military, commercial, or scientific)",
      "minAge": 15,
      "medicalRequirements": "NAUI Medical History form required",
      "requiredItems": [
        "Personal dive equipment",
        "Proof of prior diving experience"
      ],
      "materialsIncluded": true
    },
    {
      "name": "Enriched Air Nitrox (EANx) Diver",
      "code": "EANX",
      "levelCode": "specialty",
      "description": "The NAUI Nitrox Diver course teaches divers to safely use enriched air nitrox as a breathing medium. Learn about Dalton's law of partial pressures, oxygen physiology, depth limits, oxygen toxicity, gas analyzing procedures, and Equivalent Air Depth calculations.",
      "images": [
        "https://nauiwebsitestorage.blob.core.windows.net/media/2024/09/enritched.webp"
      ],
      "durationDays": 1,
      "classroomHours": 4,
      "poolHours": 0,
      "openWaterDives": 2,
      "prerequisites": "NAUI Scuba Diver certification or equivalent",
      "minAge": 15,
      "medicalRequirements": "NAUI Medical History form required",
      "requiredItems": [
        "Personal dive equipment",
        "Oxygen analyzer (provided)",
        "Nitrox-compatible dive computer"
      ],
      "materialsIncluded": true
    },
    {
      "name": "Advanced Open Water Scuba Diver",
      "code": "AOWD",
      "levelCode": "advanced",
      "description": "The NAUI Advanced Open Water Scuba Diver course introduces certified divers to a variety of open-water diving activities. Complete six dives including required dives in night/limited visibility, navigation, and deep diving (beyond 18msw/60fsw). Graduates are competent to dive without supervision.",
      "images": [
        "https://nauiwebsitestorage.blob.core.windows.net/media/2024/09/advanced-open.webp"
      ],
      "durationDays": 2,
      "classroomHours": 6,
      "poolHours": 0,
      "openWaterDives": 6,
      "prerequisites": "NAUI Open Water Scuba Diver certification or equivalent",
      "minAge": 15,
      "medicalRequirements": "NAUI Medical History form required",
      "requiredItems": [
        "Personal dive equipment",
        "Dive computer",
        "Compass",
        "Underwater light",
        "Dive slate"
      ],
      "materialsIncluded": true
    },
    {
      "name": "Rescue Scuba Diver",
      "code": "RSD",
      "levelCode": "advanced",
      "description": "The NAUI Rescue Scuba Diver course trains divers in knowledge and skills needed to manage risks and effectively handle limited in-water problems and diving emergencies. Includes assists, transports, surface rescues, and rescues from depth. This course meets rescue prerequisites for NAUI leadership certifications.",
      "images": [
        "https://nauiwebsitestorage.blob.core.windows.net/media/2024/09/rescue-suba.webp"
      ],
      "durationDays": 3,
      "classroomHours": 8,
      "poolHours": 8,
      "openWaterDives": 4,
      "prerequisites": "NAUI Open Water Scuba Diver certification or equivalent",
      "minAge": 15,
      "medicalRequirements": "NAUI Medical History form required",
      "requiredItems": [
        "Personal dive equipment",
        "Dive computer",
        "Pocket mask",
        "Rescue equipment (provided)"
      ],
      "materialsIncluded": true
    },
    {
      "name": "Advanced Rescue Diver",
      "code": "ARD",
      "levelCode": "advanced",
      "description": "The NAUI Advanced Rescue Diver course builds on rescue skills with more complex emergency scenarios and team rescue techniques. Develop advanced problem-solving abilities and leadership skills in emergency situations.",
      "images": [
        "https://images.unsplash.com/photo-1582967788606-a171c1080cb0?w=600&h=400&fit=crop"
      ],
      "durationDays": 3,
      "classroomHours": 8,
      "poolHours": 6,
      "openWaterDives": 4,
      "prerequisites": "NAUI Rescue Scuba Diver certification or equivalent",